{
  "eventId": "EVT-L01-001",
  "eventIri": "tmf:lifecycle-event/EVT-L01-001",
  "eventType": [
    "moisture-threshold-exceedance",
    "leakage-detected",
    "inspection"
  ],
  "location": "tmf:location/L-01",
  "hasReferenceLocation": "tmf:location/L-05",
  "affectedSensor": "tmf:sensor/MC-L01-01",
  "monitoringSeries": "tmf:monitoring-series/MS-L01-001",
  "validationRecord": "tmf:validation/VAL-L01-001",
  "evidenceObservationDataFile": "https://sosabaa.github.io/timber-moisture-framework/04_monitoring_record_schema/json_jsonld_implementation/monitoring_timeseries_MS-L01-001.json",
  "eventPeriod": {
    "start": "2026-08-07T10:00:00.000Z",
    "end": "2026-08-09T16:00:00.000Z"
  },
  "moistureInterpretation": {
    "thresholdExceedance": "MC above project-defined threshold",
    "exceedanceDuration": "54 hours",
    "moistureDose": "Repeated short exceedances",
    "dryingBehaviour": "Delayed drying",
    "anomalyIndicator": "Localised anomaly compared with L-05 reference",
    "confidenceOrUncertainty": "Medium confidence due to complete data but limited redundancy"
  },
  "indicators": [
    {
      "indicatorType": "threshold-exceedance",
      "result": "MC above project-defined threshold"
    },
    {
      "indicatorType": "exceedance-duration",
      "result": "54 hours"
    },
    {
      "indicatorType": "moisture-dose",
      "result": "Repeated short exceedances"
    },
    {
      "indicatorType": "drying-behaviour",
      "result": "Delayed drying"
    },
    {
      "indicatorType": "reference-location-comparison",
      "result": "Localised anomaly compared with L-05 reference"
    }
  ],
  "eventEntries": [
    {
      "timestamp": "2026-08-07T10:00:00.000Z",
      "entryType": "moisture-threshold-exceedance",
      "description": "Monitoring series indicates MC above the project-defined threshold."
    },
    {
      "timestamp": "2026-08-08T17:00:00.000Z",
      "entryType": "leakage-detected",
      "description": "Dishwasher leakage reported."
    },
    {
      "timestamp": "2026-08-08T18:00:00.000Z",
      "entryType": "inspection",
      "description": "Area inspected; no targeted opening undertaken."
    },
    {
      "timestamp": "2026-08-08T19:00:00.000Z",
      "entryType": "decision-recorded",
      "description": "Continued monitoring recommended."
    }
  ],
  "outcome": "Continued monitoring recommended."
}
